{
  "bonus": {
    "evidence_sha": {},
    "optional_ok": true
  },
  "generated_utc": "2026-03-13T07:08:52.904047+00:00",
  "pt": {
    "empty_ticket_seen": true,
    "evidence_sha": {
      "external_access_check": "17f0f971239431f07e62c6ba446e04c50a6ef25650e99d124e3d475c583c8446",
      "hosts": "64f6debae3dd88d15a950f89a78dcfc10db829efb41407cd2f64cb1f1b9ee7f1",
      "network_devices": "0477945380b2eea995dd58bca24de84ea31eb826989f0a952824cceed52c04cb",
      "postman_collection": "5f1a4fbc4ad56dd1b4527d0f8589f0cbfd197f63b6c96b7ace02c78a8685b089",
      "postman_environment": "281204cb737dec085280e3350e91a4b8f0713f04be0e9a52a4a1459a5c29de78",
      "pt_internal_output": "6370ac650d07b24c9526a577a58ff4936bd9dfa6412dc80368f24e8ed9507120",
      "service_ticket": "bf5375bf725ede467529bc32e267d9db8d079e2dfc6202a1c0d70b91852759eb"
    },
    "ok": true
  },
  "run": {
    "platform": "linux",
    "python": "3.8.2"
  },
  "schema_version": "5.0",
  "student": {
    "group": "IB235B",
    "name": "Khismatullin",
    "token": "D1-IB-23-5b-26-CE25",
    "token_hash8": "6d934724"
  },
  "validation_passed": true,
  "webex": {
    "evidence_sha": {
      "me": "4d6c64a4ac53c38d70ac2bfe540193f67b668677a6e8a575b928d9d8f25b66c5",
      "message_post": "5184d8f5050c7fb4153a1ccfd1cc39f49d19264c1290ed57df802c5815491342",
      "messages_list": "1d5bfd557cab0ed145a9c96919f277d7697b8faaa411cd49efa3be4fa62024d1",
      "room_create": "a9053e7af2ef212a0bbd5fae947c75899f7df9c2520935002c84bd6d11fde9a4",
      "rooms_list": "0343639fac1511a32a4c9a92c7655a6e9f9ad3a600fc6f30b5bdad6806160a97"
    },
    "ok": true,
    "room_title_contains_hash8": true
  },
  "yang": {
    "evidence_sha": {
      "ietf_interfaces": "9a7aee5b007de501cbdbc6fc0139dd04b795695208f9d8c6e0fc0ffbad5184db",
      "pyang_tree": "949de5d3ee156508fe0af9f6a93bb6b16cf3e397ba9f6ba226e1c50bb5256edb",
      "pyang_version": "ad9fd0b80ba4e2b83161c31e379041a917955d5c462f18ebd97e142e38f2ead0"
    },
    "ok": true
  }
}
